{
  "$schema": "https://json-schema.org/draft/2020-12/schema",
  "$id": "https://github.com/durable-workflow/.github/blob/main/release-plans/source-preparation-schema.json",
  "title": "Durable Workflow release source preparation",
  "type": "object",
  "additionalProperties": false,
  "required": [
    "$schema",
    "schema",
    "plan",
    "channel",
    "train",
    "status",
    "components",
    "authorization"
  ],
  "properties": {
    "$schema": {"const": "./source-preparation-schema.json"},
    "schema": {"const": "durable-workflow.release-source-preparation/v1"},
    "plan": {
      "type": "string",
      "pattern": "^[a-z0-9][a-z0-9._-]{0,55}$"
    },
    "channel": {"enum": ["beta", "rc"]},
    "train": {
      "type": "string",
      "pattern": "^2\\.0\\.0-(?:beta|rc)\\.[1-9][0-9]*$"
    },
    "status": {"const": "source-prepared"},
    "components": {
      "type": "object",
      "additionalProperties": false,
      "required": [
        "workflow",
        "waterline",
        "server",
        "cli",
        "sdk-php",
        "sdk-python",
        "sdk-rust"
      ],
      "properties": {
        "workflow": {"$ref": "#/$defs/changelogComponent"},
        "waterline": {"$ref": "#/$defs/changelogComponent"},
        "server": {"$ref": "#/$defs/commitMessageComponent"},
        "cli": {"$ref": "#/$defs/commitMessageComponent"},
        "sdk-php": {"$ref": "#/$defs/changelogComponent"},
        "sdk-python": {"$ref": "#/$defs/changelogComponent"},
        "sdk-rust": {"$ref": "#/$defs/commitMessageComponent"}
      }
    },
    "authorization": {
      "type": "object",
      "additionalProperties": false,
      "required": ["state", "producer"],
      "properties": {
        "state": {"const": "required-after-source-landing"},
        "producer": {
          "enum": [
            "protected-beta-authorization",
            "protected-release-candidate-authorization"
          ]
        }
      }
    }
  },
  "$defs": {
    "componentBase": {
      "type": "object",
      "required": ["version", "commit", "release_notes"],
      "properties": {
        "version": {
          "type": "string",
          "pattern": "^2\\.0\\.0-(?:beta|rc)\\.[1-9][0-9]*$"
        },
        "commit": {
          "type": "string",
          "pattern": "^[0-9a-f]{40}$"
        }
      }
    },
    "changelogComponent": {
      "unevaluatedProperties": false,
      "allOf": [
        {"$ref": "#/$defs/componentBase"},
        {
          "type": "object",
          "properties": {
            "release_notes": {"$ref": "#/$defs/changelogNotes"}
          }
        }
      ]
    },
    "commitMessageComponent": {
      "unevaluatedProperties": false,
      "allOf": [
        {"$ref": "#/$defs/componentBase"},
        {
          "type": "object",
          "properties": {
            "release_notes": {"$ref": "#/$defs/commitMessageNotes"}
          }
        }
      ]
    },
    "changelogNotes": {
      "type": "object",
      "additionalProperties": false,
      "required": ["kind", "path", "sha256"],
      "properties": {
        "kind": {"const": "changelog-unreleased"},
        "path": {"const": "CHANGELOG.md"},
        "sha256": {"type": "string", "pattern": "^[0-9a-f]{64}$"}
      }
    },
    "commitMessageNotes": {
      "type": "object",
      "additionalProperties": false,
      "required": ["kind", "sha256"],
      "properties": {
        "kind": {"const": "source-commit-message"},
        "sha256": {"type": "string", "pattern": "^[0-9a-f]{64}$"}
      }
    }
  },
  "allOf": [
    {
      "if": {
        "properties": {"channel": {"const": "beta"}},
        "required": ["channel"]
      },
      "then": {
        "properties": {
          "train": {"pattern": "^2\\.0\\.0-beta\\.[1-9][0-9]*$"},
          "components": {
            "additionalProperties": {
              "properties": {
                "version": {"pattern": "^2\\.0\\.0-beta\\.[1-9][0-9]*$"}
              }
            }
          },
          "authorization": {
            "properties": {
              "producer": {"const": "protected-beta-authorization"}
            }
          }
        }
      },
      "else": {
        "properties": {
          "train": {"pattern": "^2\\.0\\.0-rc\\.[1-9][0-9]*$"},
          "components": {
            "additionalProperties": {
              "properties": {
                "version": {"pattern": "^2\\.0\\.0-rc\\.[1-9][0-9]*$"}
              }
            }
          },
          "authorization": {
            "properties": {
              "producer": {"const": "protected-release-candidate-authorization"}
            }
          }
        }
      }
    }
  ]
}
