{
  "$schema": "./source-preparation-schema.json",
  "schema": "durable-workflow.release-source-preparation/v1",
  "plan": "coherent-2-0-rc-1",
  "channel": "rc",
  "train": "2.0.0-rc.1",
  "status": "source-prepared",
  "components": {
    "workflow": {
      "version": "2.0.0-rc.1",
      "commit": "864cd6f2e11a60ddbd221548019df8ef0cd8f812",
      "release_notes": {
        "kind": "changelog-unreleased",
        "path": "CHANGELOG.md",
        "sha256": "70b2d667e532b144094bb12d75e073b449d4319df3e75de9bda028d1230eb222"
      }
    },
    "waterline": {
      "version": "2.0.0-rc.1",
      "commit": "16c2fde277c19199ac3465fa79555aab97cd4115",
      "release_notes": {
        "kind": "changelog-unreleased",
        "path": "CHANGELOG.md",
        "sha256": "e9a945668317baeaddc95e0d2f4d19b286a680be219af2ad14aa8a2e13e01431"
      }
    },
    "server": {
      "version": "2.0.0-rc.2",
      "commit": "2627e13c0a9c52572b6732f9696f5f78681eca7b",
      "release_notes": {
        "kind": "source-commit-message",
        "sha256": "307fc912774b10675de920f944bf23107ebe12fd70465fd74615a45ebd13e647"
      }
    },
    "cli": {
      "version": "2.0.0-rc.1",
      "commit": "f06ed54d3adefa686d8b5575c989268fc15f8529",
      "release_notes": {
        "kind": "source-commit-message",
        "sha256": "2ce32b002fa9ec00cf6712c6b76936969be340a981e77abcc636fabee88ef4df"
      }
    },
    "sdk-php": {
      "version": "2.0.0-rc.1",
      "commit": "5136659df919f80bcac788f7148135fdb373ebbd",
      "release_notes": {
        "kind": "changelog-unreleased",
        "path": "CHANGELOG.md",
        "sha256": "6de8f3f9e53bed94475aa17a524ccedd9c77870a97e34ba6ea6b72e28c37bf68"
      }
    },
    "sdk-python": {
      "version": "2.0.0-rc.1",
      "commit": "e8f21a0a886d055f662a1c893467d1edd0b50b1c",
      "release_notes": {
        "kind": "changelog-unreleased",
        "path": "CHANGELOG.md",
        "sha256": "f853d32e66cb4bebc08a39c7b8c44848a33f757c42f571301c3de03ef092abda"
      }
    },
    "sdk-rust": {
      "version": "2.0.0-rc.1",
      "commit": "0c69fed9a17e50c041e27d427d6dd043c014df84",
      "release_notes": {
        "kind": "source-commit-message",
        "sha256": "2ce32b002fa9ec00cf6712c6b76936969be340a981e77abcc636fabee88ef4df"
      }
    }
  },
  "authorization": {
    "state": "required-after-source-landing",
    "producer": "protected-release-candidate-authorization"
  }
}
